{
  "contract_name": "worker.registration",
  "contract_version": "1.0.0",
  "schema_version": "1.0.0",
  "taxonomy_version": "taxonomy-recon-v1",
  "tenant_id": "tenant-lab-001",
  "customer_context_id": "customer-context-main",
  "environment": "phase0_lab",
  "correlation_id": "corr:registration:arc-worker-001",
  "causation_id": "registration-challenge-001",
  "idempotency_key": "registration:arc-worker-001:boot-lab-001",
  "producer": {
    "component": "worker",
    "produced_at": "2026-07-25T05:00:00Z"
  },
  "policy_version": "policy-phase0-v1",
  "registration_id": "registration:arc-worker-001:boot-lab-001",
  "worker_id": "arc-worker-001",
  "worker_role": "general_office_arc_worker",
  "channel_identity_ref": "lab-key-001",
  "boot_id": "boot-lab-001",
  "worker_version": "arc-bot-shell-0.1.0",
  "capabilities": [
    "document_read",
    "it_diagnostics_read_only"
  ],
  "registration_state": "requested",
  "runtime_authority_blocked": true,
  "executable": false,
  "execution_allowed": false,
  "side_effects_allowed": false,
  "created_at": "2026-07-25T05:00:00Z"
}
